accession,title,modalities,sample_size,access_type,contact_email,link
GSE303326,Variation at the R181 residue of p53 confer loss of p53 DNA binding cooperativity with the retention of mitochondrial-associated apoptosis,Expression profiling by high throughput sequencing (RNA-seq),54,Public (Download data available),,https://www.ncbi.nlm.nih.gov/geo/query/acc.cgi?acc=GSE303326
GSE275258,Regulation of undruggable c-MYC with controlled photothermal therapy for efficient cancer immunotherapy,Expression profiling by high throughput sequencing (RNA-seq),20,Public (Download data available),tiit.ord@uef.fi,https://www.ncbi.nlm.nih.gov/geo/query/acc.cgi?acc=GSE275258
GSE279021,Transcriptional programs of cell identity and p53-induced stress responses are associated with distinctive features of spatial genome organization [SuperSeries],"Genome binding/occupancy profiling by high throughput sequencing, Other, Expression profiling by high throughput sequencing (RNA-seq)",160,Public (Download data available),jmlim@berkeley.edu,https://www.ncbi.nlm.nih.gov/geo/query/acc.cgi?acc=GSE279021
GSE278979,Transcriptional programs of cell identity and p53-induced stress responses are associated with distinctive features of spatial genome organization [RNA-seq],Expression profiling by high throughput sequencing (RNA-seq),40,Public (Download data available),jmlim@berkeley.edu,https://www.ncbi.nlm.nih.gov/geo/query/acc.cgi?acc=GSE278979
GSE278978,Transcriptional programs of cell identity and p53-induced stress responses are associated with distinctive features of spatial genome organization [Micro-C],Other (Micro-C),40,Public (Download data available),jmlim@berkeley.edu,https://www.ncbi.nlm.nih.gov/geo/query/acc.cgi?acc=GSE278978
